{"generado":"2026-10-16T09:04:44Z","periodo_ref":{"desde":"2025-07","hasta":"2026-06"},"cortes":{"atencion":40.9,"desempeno":50.0},"componentes_disponibles":["busqueda","asistentes"],"destinos":[{"destino_id":"atlixco","ocupacion_12m":44.8,"cuartos_libres_dia_12m":436.1,"llegadas_12m":217090,"crecimiento_llegadas_pct":3.9,"componentes":{"busqueda":{"valor":38.92,"pctl":90.9,"n":12},"asistentes":{"valor":55.53,"pctl":77.3,"n":380}},"indice_atencion":84.1,"indice_desempeno":81.8,"brecha":2.3,"cuadrante":"consolidado","sensible":false,"notas":["Sin dato de video, panel","Con solo 2 componentes no se puede medir la sensibilidad"]},{"destino_id":"chignahuapan","ocupacion_12m":44.5,"cuartos_libres_dia_12m":671.7,"llegadas_12m":348244,"crecimiento_llegadas_pct":5.3,"componentes":{"busqueda":{"valor":16.75,"pctl":81.8,"n":12},"asistentes":{"valor":50.79,"pctl":63.6,"n":380}},"indice_atencion":72.7,"indice_desempeno":63.6,"brecha":9.1,"cuadrante":"consolidado","sensible":false,"notas":["Sin dato de video, panel","Con solo 2 componentes no se puede medir la sensibilidad"]},{"destino_id":"cholula","ocupacion_12m":57.8,"cuartos_libres_dia_12m":626.4,"llegadas_12m":539039,"crecimiento_llegadas_pct":2.7,"componentes":{"busqueda":{"valor":57.5,"pctl":100.0,"n":12},"asistentes":{"valor":78.68,"pctl":100.0,"n":380}},"indice_atencion":100.0,"indice_desempeno":100.0,"brecha":0.0,"cuadrante":"consolidado","sensible":false,"notas":["Sin dato de video, panel","Con solo 2 componentes no se puede medir la sensibilidad"]},{"destino_id":"cuetzalan","ocupacion_12m":42.7,"cuartos_libres_dia_12m":418.0,"llegadas_12m":203564,"crecimiento_llegadas_pct":8.5,"componentes":{"busqueda":{"valor":16.17,"pctl":63.6,"n":12},"asistentes":{"valor":55.53,"pctl":77.3,"n":380}},"indice_atencion":70.5,"indice_desempeno":27.3,"brecha":43.2,"cuadrante":"atencion_sin_estancia","sensible":false,"notas":["Sin dato de video, panel","Con solo 2 componentes no se puede medir la sensibilidad"]},{"destino_id":"huauchinango","ocupacion_12m":44.4,"cuartos_libres_dia_12m":248.9,"llegadas_12m":127671,"crecimiento_llegadas_pct":4.7,"componentes":{"busqueda":{"valor":16.39,"pctl":72.7,"n":12},"asistentes":{"valor":11.32,"pctl":9.1,"n":380}},"indice_atencion":40.9,"indice_desempeno":54.5,"brecha":-13.6,"cuadrante":"consolidado","sensible":false,"notas":["Sin dato de video, panel","Con solo 2 componentes no se puede medir la sensibilidad"]},{"destino_id":"huejotzingo","ocupacion_12m":43.6,"cuartos_libres_dia_12m":104.7,"llegadas_12m":45087,"crecimiento_llegadas_pct":-1.5,"componentes":{"busqueda":{"valor":10.58,"pctl":36.4,"n":12},"asistentes":{"valor":25.53,"pctl":45.5,"n":380}},"indice_atencion":40.9,"indice_desempeno":36.4,"brecha":4.5,"cuadrante":"atencion_sin_estancia","sensible":false,"notas":["Sin dato de video, panel","Con solo 2 componentes no se puede medir la sensibilidad"]},{"destino_id":"pahuatlan","ocupacion_12m":32.2,"cuartos_libres_dia_12m":105.2,"llegadas_12m":33553,"crecimiento_llegadas_pct":0.5,"componentes":{"busqueda":{"valor":0.52,"pctl":0.0,"n":12},"asistentes":{"valor":17.89,"pctl":27.3,"n":380}},"indice_atencion":13.6,"indice_desempeno":0.0,"brecha":13.6,"cuadrante":"por_posicionar","sensible":false,"notas":["Sin dato de video, panel","Con solo 2 componentes no se puede medir la sensibilidad"]},{"destino_id":"tetela-de-ocampo","ocupacion_12m":33.8,"cuartos_libres_dia_12m":105.9,"llegadas_12m":35335,"crecimiento_llegadas_pct":-0.8,"componentes":{"busqueda":{"valor":2.39,"pctl":9.1,"n":12},"asistentes":{"valor":18.16,"pctl":36.4,"n":380}},"indice_atencion":22.7,"indice_desempeno":9.1,"brecha":13.6,"cuadrante":"por_posicionar","sensible":false,"notas":["Sin dato de video, panel","Con solo 2 componentes no se puede medir la sensibilidad"]},{"destino_id":"teziutlan","ocupacion_12m":44.5,"cuartos_libres_dia_12m":262.3,"llegadas_12m":136443,"crecimiento_llegadas_pct":21.6,"componentes":{"busqueda":{"valor":12.84,"pctl":45.5,"n":12},"asistentes":{"valor":6.32,"pctl":0.0,"n":380}},"indice_atencion":22.7,"indice_desempeno":72.7,"brecha":-50.0,"cuadrante":"demanda_poco_visible","sensible":false,"notas":["Sin dato de video, panel","Con solo 2 componentes no se puede medir la sensibilidad"]},{"destino_id":"tlatlauquitepec","ocupacion_12m":36.8,"cuartos_libres_dia_12m":189.0,"llegadas_12m":70432,"crecimiento_llegadas_pct":7.6,"componentes":{"busqueda":{"valor":6.07,"pctl":18.2,"n":12},"asistentes":{"valor":29.47,"pctl":54.5,"n":380}},"indice_atencion":36.4,"indice_desempeno":18.2,"brecha":18.2,"cuadrante":"por_posicionar","sensible":false,"notas":["Sin dato de video, panel","Con solo 2 componentes no se puede medir la sensibilidad"]},{"destino_id":"xicotepec","ocupacion_12m":43.8,"cuartos_libres_dia_12m":179.9,"llegadas_12m":90140,"crecimiento_llegadas_pct":8.0,"componentes":{"busqueda":{"valor":13.29,"pctl":54.5,"n":12},"asistentes":{"valor":11.58,"pctl":18.2,"n":380}},"indice_atencion":36.4,"indice_desempeno":45.5,"brecha":-9.1,"cuadrante":"por_posicionar","sensible":false,"notas":["Sin dato de video, panel","Con solo 2 componentes no se puede medir la sensibilidad"]},{"destino_id":"zacatlan","ocupacion_12m":53.0,"cuartos_libres_dia_12m":676.8,"llegadas_12m":487872,"crecimiento_llegadas_pct":9.3,"componentes":{"busqueda":{"valor":8.25,"pctl":27.3,"n":12},"asistentes":{"valor":56.84,"pctl":90.9,"n":380}},"indice_atencion":59.1,"indice_desempeno":90.9,"brecha":-31.8,"cuadrante":"consolidado","sensible":false,"notas":["Sin dato de video, panel","Con solo 2 componentes no se puede medir la sensibilidad"]}],"referencia":{"destino_id":"puebla","ocupacion_12m":60.1,"cuartos_libres_dia_12m":4263.9,"llegadas_12m":3273415,"crecimiento_llegadas_pct":2.6,"componentes":{},"indice_atencion":null,"indice_desempeno":null,"brecha":null,"cuadrante":null,"sensible":false,"notas":["Referencia: no entra en los percentiles"]}}
